01665500,"RAPIDAN RIVER NEAR RUCKERSVILLE, VA",2025-11-30 19:45:00+00:00,29.0,38.28068606,-78.340007,-3.6544850498338914,3.942652329749109,,334,"RAPIDAN RIVER NEAR RUCKERSVILLE, VA",north,252.79999999999995,0.11471518987341774,False,11.471518987341774
02051000,"NORTH MEHERRIN RIVER NEAR LUNENBURG, VA",2025-11-30 19:45:00+00:00,6.44,36.9973738,-78.3497182,0.0,0.0,,334,"NORTH MEHERRIN RIVER NEAR LUNENBURG, VA",south,38.16,0.1687631027253669,False,16.876310272536692
01633000,"N F SHENANDOAH RIVER AT MOUNT JACKSON, VA",2025-11-30 19:45:00+00:00,47.7,38.74567048,-78.6389042,-11.829944547134932,-14.362657091561939,,334,"N F SHENANDOAH RIVER AT MOUNT JACKSON, VA",north,556.3999999999997,0.08572969086987783,False,8.572969086987783
03531500,"POWELL RIVER NEAR JONESVILLE, VA",2025-11-30 19:45:00+00:00,317.0,36.66203367,-83.0948928,0.0,-1.2461059190031152,,334,"POWELL RIVER NEAR JONESVILLE, VA",south,474.3999999999995,0.6682124789207426,False,66.82124789207427
02022500,"KERRS CREEK NEAR LEXINGTON, VA",2025-11-30 19:45:00+00:00,7.23,37.82568687,-79.4430938,0.0,8.88554216867471,,334,"KERRS CREEK NEAR LEXINGTON, VA",north,36.04,0.20061043285238625,False,20.061043285238625
02031000,"MECHUMS RIVER NEAR WHITE HALL, VA",2025-11-30 19:45:00+00:00,27.1,38.10263608,-78.5927935,0.0,3.4351145038168025,,334,"MECHUMS RIVER NEAR WHITE HALL, VA",north,143.79999999999995,0.1884561891515995,False,18.84561891515995
02020500,"CALFPASTURE RIVER ABOVE MILL CREEK AT GOSHEN, VA",2025-11-30 19:45:00+00:00,10.7,37.98790619,-79.49365288,0.0,4.901960784313726,,334,"CALFPASTURE RIVER ABOVE MILL CREEK AT GOSHEN, VA",north,163.99999999999994,0.0652439024390244,False,6.524390243902441
0205551614,"TINKER CREEK ABOVE GLADE CREEK AT ROANOKE, VA",2025-11-30 19:45:00+00:00,27.3,37.27788889,-79.9093611,0.0,0.0,,334,"TINKER CREEK ABOVE GLADE CREEK AT ROANOKE, VA",south,75.55000000000001,0.36135009927200523,False,36.13500992720052
02056900,"BLACKWATER RIVER NEAR ROCKY MOUNT, VA",2025-11-30 19:45:00+00:00,42.5,37.0451406,-79.8441993,-6.593406593406594,-4.49438202247191,,334,"BLACKWATER RIVER NEAR ROCKY MOUNT, VA",south,192.4,0.2208939708939709,False,22.08939708939709
02051190,"MEHERRIN RIVER AT RT 637 NEAR SOUTH HILL, VA",2025-11-30 19:45:00+00:00,41.8,36.78694444,-78.1175,0.0,0.0,,334,"MEHERRIN RIVER AT RT 637 NEAR SOUTH HILL, VA",south,149.0,0.28053691275167786,False,28.053691275167786
02018500,"CATAWBA CREEK NEAR CATAWBA, VA",2025-11-30 19:45:00+00:00,5.67,37.46818624,-80.00532199,-6.435643564356431,6.981132075471701,,334,"CATAWBA CREEK NEAR CATAWBA, VA",south,44.2,0.12828054298642533,False,12.828054298642533
02041650,"APPOMATTOX RIVER AT MATOACA, VA",2025-11-30 19:45:00+00:00,251.0,37.2251505,-77.475263,0.0,1.2096774193548387,,334,"APPOMATTOX RIVER AT MATOACA, VA",south,1653.9999999999998,0.15175332527206772,False,15.175332527206772
02051500,"MEHERRIN RIVER NEAR LAWRENCEVILLE, VA",2025-11-30 19:45:00+00:00,106.0,36.71681395,-77.8316582,0.0,0.0,,334,"MEHERRIN RIVER NEAR LAWRENCEVILLE, VA",south,496.8,0.21336553945249598,False,21.336553945249598
02055100,"TINKER CREEK NEAR DALEVILLE, VA",2025-11-30 19:45:00+00:00,3.19,37.41763318,-79.9353193,0.0,0.0,,334,"TINKER CREEK NEAR DALEVILLE, VA",south,16.36,0.1949877750611247,False,19.498777506112468
02032250,"MOORMANS RIVER NEAR FREE UNION, VA",2025-11-30 19:45:00+00:00,10.1,38.1406902,-78.5558478,4.231166150670796,4.231166150670796,,334,"MOORMANS RIVER NEAR FREE UNION, VA",north,130.39999999999995,0.07745398773006137,False,7.745398773006137
02056000,"ROANOKE RIVER AT NIAGARA, VA",2025-11-30 19:45:00+00:00,154.0,37.2551384,-79.87142539,8.450704225352112,14.925373134328357,,334,"ROANOKE RIVER AT NIAGARA, VA",south,631.5999999999999,0.2438252058264725,False,24.38252058264725
01654670,"ACCOTINK CREEK AT KEENE MILL RD AT SPRINGFIELD, VA",2025-11-30 19:50:00+00:00,3.86,38.7751822,-77.20324308,9.659090909090905,21.003134796238243,49.034749034749034,334,"ACCOTINK CREEK AT KEENE MILL RD AT SPRINGFIELD, VA",north,12.0,0.32166666666666666,False,32.166666666666664
01643880,"BEAVERDAM CREEK AT RT 734 NEAR MOUNTVILLE, VA",2025-11-30 19:50:00+00:00,1.41,39.0377222,-77.72225,0.0,0.0,0.0,334,"BEAVERDAM CREEK AT RT 734 NEAR MOUNTVILLE, VA",north,63.19999999999998,0.022310126582278485,False,2.2310126582278484
02024000,"MAURY RIVER NEAR BUENA VISTA, VA",2025-11-30 19:55:00+00:00,97.8,37.76263275,-79.3914251,-2.200000000000003,-2.200000000000003,0.0,334,"MAURY RIVER NEAR BUENA VISTA, VA",north,858.3999999999996,0.11393289841565708,False,11.393289841565709
02072500,"SMITH RIVER AT BASSETT, VA",2025-11-30 19:55:00+00:00,86.9,36.77013709,-80.00087509,0.0,0.0,0.0,334,"SMITH RIVER AT BASSETT, VA",south,767.0,0.11329856584093873,False,11.329856584093873
02072000,"SMITH RIVER NEAR PHILPOTT, VA",2025-11-30 19:55:00+00:00,75.5,36.7806925,-80.0247647,0.0,0.0,0.0,334,"SMITH RIVER NEAR PHILPOTT, VA",south,612.9999999999999,0.12316476345840133,False,12.316476345840133
0164579522,"THE GLADE NEAR HOWLAND DRIVE AT RESTON, VA",2025-11-30 19:55:00+00:00,0.03,38.9256,-77.32933889,0.0,0.0,0.0,334,"THE GLADE NEAR HOWLAND DRIVE AT RESTON, VA",north,0.503,0.05964214711729622,False,5.964214711729622
01643590,"LIMESTONE BRANCH NEAR LEESBURG, VA",2025-11-30 19:55:00+00:00,1.04,39.1676111,-77.5359167,0.0,0.0,0.0,334,"LIMESTONE BRANCH NEAR LEESBURG, VA",north,7.979999999999993,0.13032581453634096,False,13.032581453634096
03488000,"N F HOLSTON RIVER NEAR SALTVILLE, VA",2025-11-30 19:55:00+00:00,68.5,36.89678115,-81.7462293,0.0,0.0,0.0,334,"N F HOLSTON RIVER NEAR SALTVILLE, VA",south,422.79999999999984,0.16201513718070015,False,16.201513718070014
03474000,"M F HOLSTON RIVER AT SEVEN MILE FORD, VA",2025-11-30 19:55:00+00:00,42.0,36.80733756,-81.6220617,0.0,0.0,0.0,334,"M F HOLSTON RIVER AT SEVEN MILE FORD, VA",south,213.39999999999995,0.196813495782568,False,19.6813495782568
01654500,"LONG BRANCH NEAR ANNANDALE, VA",2025-11-30 19:55:00+00:00,0.58,38.81358508,-77.2364549,23.404255319148934,52.63157894736841,70.58823529411762,334,"LONG BRANCH NEAR ANNANDALE, VA",north,4.57,0.12691466083150982,False,12.691466083150981
01671200,"SOUTH ANNA RIVER NEAR GORDONSVILLE, VA",2025-11-30 20:00:00+00:00,0.57,38.1237471,-78.2052814,0.0,13.99999999999999,,334,"SOUTH ANNA RIVER NEAR GORDONSVILLE, VA",north,0.98,0.5816326530612245,False,58.16326530612245
01638350,"S F CATOCTIN CREEK AT RT 698 NEAR WATERFORD, VA",2025-11-30 20:00:00+00:00,3.24,39.1911111,-77.6154444,0.0,5.537459283387634,0.0,334,"S F CATOCTIN CREEK AT RT 698 NEAR WATERFORD, VA",north,37.41999999999997,0.08658471405665426,False,8.658471405665425
03478400,"BEAVER CREEK AT BRISTOL, VA",2025-11-30 20:00:00+00:00,19.5,36.63177439,-82.1337425,3.174603174603182,10.795454545454536,10.795454545454536,334,"BEAVER CREEK AT BRISTOL, VA",south,45.2,0.43141592920353977,False,43.14159292035398
01645762,"S F LITTLE DIFFICULT RUN ABOVE MOUTH NR VIENNA, VA",2025-11-30 20:00:00+00:00,0.29,38.90888916,-77.3382627,0.0,0.0,15.999999999999993,334,"S F LITTLE DIFFICULT RUN ABOVE MOUTH NR VIENNA, VA",north,2.6020000000000008,0.11145272867025362,False,11.145272867025362
02019500,"JAMES RIVER AT BUCHANAN, VA",2025-11-30 20:00:00+00:00,459.0,37.53068995,-79.6789281,0.0,1.3245033112582782,,334,"JAMES RIVER AT BUCHANAN, VA",north,2157.999999999999,0.21269694161260436,False,21.269694161260436
03165000,"CHESTNUT CREEK AT GALAX, VA",2025-11-30 20:00:00+00:00,33.3,36.6459613,-80.9192444,0.0,3.4161490683229636,,334,"CHESTNUT CREEK AT GALAX, VA",south,140.8,0.23650568181818177,False,23.650568181818176
02060500,"ROANOKE RIVER AT ALTAVISTA, VA",2025-11-30 20:00:00+00:00,618.0,37.10569444,-79.28563889,1.3114754098360655,0.0,,334,"ROANOKE RIVER AT ALTAVISTA, VA",south,2950.0,0.2094915254237288,False,20.949152542372882
01646305,"DEAD RUN AT WHANN AVENUE NEAR MCLEAN, VA",2025-11-30 20:00:00+00:00,0.06,38.95977716,-77.1756743,49.999999999999986,49.999999999999986,49.999999999999986,334,"DEAD RUN AT WHANN AVENUE NEAR MCLEAN, VA",north,2.21,0.027149321266968326,False,2.7149321266968327
02016500,"JAMES RIVER AT LICK RUN, VA",2025-11-30 20:00:00+00:00,375.0,37.77374009,-79.7844925,1.078167115902965,3.591160220994475,,334,"JAMES RIVER AT LICK RUN, VA",north,1395.999999999999,0.2686246418338111,False,26.862464183381107
03167000,"REED CREEK AT GRAHAMS FORGE, VA",2025-11-30 20:00:00+00:00,53.8,36.93900995,-80.8872997,0.0,-3.584229390681004,,334,"REED CREEK AT GRAHAMS FORGE, VA",south,337.6,0.1593601895734597,False,15.93601895734597
01620500,"NORTH RIVER NEAR STOKESVILLE, VA",2025-11-30 20:00:00+00:00,9.55,38.335,-79.2391667,0.0,0.0,0.0,334,"NORTH RIVER NEAR STOKESVILLE, VA",north,30.09999999999999,0.3172757475083058,False,31.727574750830577
02040892,"APPOMATTOX RIVER AT ROUTE 602 NEAR MANNBORO, VA",2025-11-30 20:00:00+00:00,249.0,37.31805556,-77.8016667,-1.1904761904761905,-5.323193916349809,,334,"APPOMATTOX RIVER AT ROUTE 602 NEAR MANNBORO, VA",south,1160.0,0.21465517241379312,False,21.465517241379313
01668000,"RAPPAHANNOCK RIVER NEAR FREDERICKSBURG, VA",2025-11-30 20:00:00+00:00,189.0,38.30846178,-77.52915268,-7.804878048780488,-4.060913705583756,,334,"RAPPAHANNOCK RIVER NEAR FREDERICKSBURG, VA",north,2225.999999999999,0.08490566037735853,False,8.490566037735853
02042500,"CHICKAHOMINY RIVER NEAR PROVIDENCE FORGE, VA",2025-11-30 20:00:00+00:00,139.0,37.43625765,-77.0608027,-4.137931034482759,-14.723926380368098,,334,"CHICKAHOMINY RIVER NEAR PROVIDENCE FORGE, VA",south,607.0,0.22899505766062603,False,22.899505766062603
01632900,"SMITH CREEK NEAR NEW MARKET, VA",2025-11-30 20:00:00+00:00,17.3,38.69345016,-78.6427935,0.0,0.0,,334,"SMITH CREEK NEAR NEW MARKET, VA",north,127.19999999999996,0.13600628930817615,False,13.600628930817615
02074500,"SANDY RIVER NEAR DANVILLE, VA",2025-11-30 20:00:00+00:00,34.1,36.6195825,-79.5041932,0.0,0.0,,334,"SANDY RIVER NEAR DANVILLE, VA",south,115.6,0.29498269896193774,False,29.498269896193776
02025652,"HARRIS CREEK BELOW ROUTE 130 NEAR MONROE, VA",2025-11-30 20:00:00+00:00,5.33,37.48527778,-79.1666667,0.0,-26.58402203856749,,334,"HARRIS CREEK BELOW ROUTE 130 NEAR MONROE, VA",south,44.000000000000014,0.1211363636363636,False,12.11363636363636
02058400,"PIGG RIVER NEAR SANDY LEVEL, VA",2025-11-30 20:00:00+00:00,112.0,36.9459767,-79.5247508,0.0,-1.7543859649122806,,334,"PIGG RIVER NEAR SANDY LEVEL, VA",south,458.0,0.2445414847161572,False,24.45414847161572
01652090,"FOUR MILE RUN AT HWY 29 AT FALLS CHURCH, VA",2025-11-30 20:00:00+00:00,1.33,38.8863,-77.1635,19.819819819819813,-15.286624203821656,46.15384615384615,334,"FOUR MILE RUN AT HWY 29 AT FALLS CHURCH, VA",north,0.478,2.782426778242678,True,278.2426778242678
02077000,"BANISTER RIVER AT HALIFAX, VA",2025-11-30 20:00:00+00:00,133.0,36.7765267,-78.9158438,-2.2058823529411766,-1.4814814814814816,,334,"BANISTER RIVER AT HALIFAX, VA",south,443.7000000000001,0.2997520847419427,False,29.97520847419427
02021500,"MAURY RIVER AT ROCKBRIDGE BATHS, VA",2025-11-30 20:00:00+00:00,37.5,37.90735266,-79.42198289,0.0,3.3057851239669507,,334,"MAURY RIVER AT ROCKBRIDGE BATHS, VA",north,336.7999999999998,0.11134204275534448,False,11.134204275534449
01652620,"TRIPPS RUN AT FALLS CHURCH, VA",2025-11-30 20:00:00+00:00,0.19,38.87944444,-77.1791667,58.333333333333336,0.0,171.4285714285714,334,"TRIPPS RUN AT FALLS CHURCH, VA",north,0.292,0.6506849315068494,False,65.06849315068493
01656903,"FLATLICK BRANCH ABOVE FROG BRANCH AT CHANTILLY, VA",2025-11-30 20:00:00+00:00,0.7,38.8823899,-77.4319047,-13.580246913580257,-33.962264150943405,16.666666666666664,334,"FLATLICK BRANCH ABOVE FROG BRANCH AT CHANTILLY, VA",north,6.372000000000002,0.10985561833019457,False,10.985561833019457
02011460,"BACK CREEK NEAR SUNRISE, VA",2025-11-30 20:00:00+00:00,11.8,38.24540129,-79.76866328,0.0,0.0,,334,"BACK CREEK NEAR SUNRISE, VA",north,62.15999999999996,0.18983268983268997,False,18.983268983268996
03165500,"NEW RIVER AT IVANHOE, VA",2025-11-30 20:05:00+00:00,966.0,36.83484534,-80.9525807,0.0,0.0,0.0,334,"NEW RIVER AT IVANHOE, VA",south,2946.0,0.32790224032586557,False,32.79022403258656
02039500,"APPOMATTOX RIVER AT FARMVILLE, VA",2025-11-30 20:05:00+00:00,102.0,37.3070965,-78.388607,-0.9708737864077669,-2.857142857142857,-5.555555555555555,334,"APPOMATTOX RIVER AT FARMVILLE, VA",south,299.4,0.3406813627254509,False,34.06813627254509
02053800,"S F ROANOKE RIVER NEAR SHAWSVILLE, VA",2025-11-30 20:05:00+00:00,26.8,37.1401323,-80.2664328,0.0,3.875968992248062,3.875968992248062,334,"S F ROANOKE RIVER NEAR SHAWSVILLE, VA",south,145.39999999999998,0.18431911966987624,False,18.431911966987624
02055000,"ROANOKE RIVER AT ROANOKE, VA",2025-11-30 20:05:00+00:00,64.0,37.25847085,-79.9386485,0.0,3.225806451612903,6.666666666666667,334,"ROANOKE RIVER AT ROANOKE, VA",south,404.5999999999999,0.1581809194265942,False,15.818091942659422
02034000,"RIVANNA RIVER AT PALMYRA, VA",2025-11-30 20:05:00+00:00,108.0,37.8579192,-78.2658373,0.0,0.0,0.0,334,"RIVANNA RIVER AT PALMYRA, VA",north,859.9999999999997,0.12558139534883725,False,12.558139534883725
02054500,"ROANOKE RIVER AT LAFAYETTE, VA",2025-11-30 20:05:00+00:00,57.2,37.23652179,-80.2092089,0.0,2.8776978417266212,5.925925925925931,334,"ROANOKE RIVER AT LAFAYETTE, VA",south,274.99999999999994,0.20800000000000005,False,20.800000000000004
02044500,"NOTTOWAY RIVER NEAR RAWLINGS, VA",2025-11-30 20:05:00+00:00,77.8,36.9834822,-77.7997188,0.0,-2.2613065326633133,-6.71462829736212,334,"NOTTOWAY RIVER NEAR RAWLINGS, VA",south,292.19999999999993,0.26625598904859693,False,26.625598904859693
01653000,"CAMERON RUN AT ALEXANDRIA, VA",2025-11-30 20:05:00+00:00,15.9,38.8044466,-77.10558989,0.0,21.374045801526723,145.7496136012365,334,"CAMERON RUN AT ALEXANDRIA, VA",north,37.36,0.42558886509635974,False,42.558886509635975
01652500,"FOURMILE RUN AT ALEXANDRIA, VA",2025-11-30 20:05:00+00:00,7.29,38.8433333,-77.0858611,8.968609865470846,19.31260229132569,231.36363636363635,334,"FOURMILE RUN AT ALEXANDRIA, VA",north,14.799999999999995,0.4925675675675677,False,49.25675675675677
